### ISSUE TITLE
Traefik 3.6 UDP malformed packets

### ISSUE THREAD

**Issue by leonjza** [traefik/traefik#12252]
### Welcome!

- [x] Yes, I've searched similar issues on [GitHub](https://github.com/traefik/traefik/issues) and didn't find any.
- [x] Yes, I've searched similar issues on the [Traefik community forum](https://community.traefik.io) and didn't find any.

### What did you do?

I have <https://github.com/AdguardTeam/AdGuardHome> self-hosted behind Traefik, using the Traefik UDP proxy feature to funnel DNS lookups to AdGuard from private networks. Both AdGuard and Traefik are hosted using docker containers.

Since Traefik v3.6, UDP traffic appears to arrive malformed to upstream services, meaning that when I do a DNS lookup (using UDP), I get error logs as follows in the AdGuard Home service:

```
adguard  | 2025/11/10 07:26:12.997326 [error] dnsproxy: unpacking udp packet err="dns: overflow unpacking uint32"
adguard  | 2025/11/10 07:26:13.983242 [error] dnsproxy: unpacking udp packet err="dns: overflow unpacking uint32"
adguard  | 2025/11/10 07:26:18.987380 [error] dnsproxy: unpacking udp packet err="dns: overflow unpacking uint32"
adguard  | 2025/11/10 07:26:19.987788 [error] dnsproxy: unpacking udp packet err="dns: overflow unpacking uint32"
```

Downgrading to v3.5 solves the problem, or making requests directly to the upstream service (bypassing Traefik).

### What did you see instead?

Performing a lookup fails with a Traefik 3.6 powered UDP proxy. The target host here is chosen such that it's not something that is potentially cached, forcing a lookup.

```
❯ dig -p 5553 ads.reddit.com @localhost

; <<>> DiG 9.10.6 <<>> -p 5553 ads.reddit.com @localhost
;; global options: +cmd
;; connection timed out; no servers could be reached
```

Running a tcpdump session inside of the AdGuard container (where the UDP frame would come from the client -> Traefik -> AdGuard) will show the following output, where it looks like the whole UDP frame does not always make it to the container from Traefik. Because `dig` will retry automatically, sometimes it will get a response. That can be seen in the last 2 packets. It's as if the last four bytes don't make it in failed cases.

```
07:48:39.835467 IP 192.168.97.2.32946 > 192.168.97.3.53: 27822+ [1au] A? ads.reddit.com. (39)
        0x0000:  4500 0043 b775 4000 4011 3fde c0a8 6102  E..C.u@.@.?...a.
        0x0010:  c0a8 6103 80b2 0035 002f 4397 6cae 0120  ..a....5./C.l...
        0x0020:  0001 0000 0000 0001 0361 6473 0672 6564  .........ads.red
        0x0030:  6469 7403 636f 6d00 0001 0001 0000 2910  dit.com.......).
        0x0040:  0000 00                                  ...
07:48:40.839153 IP 192.168.97.2.39232 > 192.168.97.3.53: 27822+ [1au] A? ads.reddit.com. (43)
        0x0000:  4500 0047 d745 4000 4011 200a c0a8 6102  E..G.E@.@.....a.
        0x0010:  c0a8 6103 9940 0035 0033 439b 6cae 0120  ..a..@.5.3C.l...
        0x0020:  0001 0000 0000 0001 0361 6473 0672 6564  .........ads.red
        0x0030:  6469 7403 636f 6d00 0001 0001 0000 2910  dit.com.......).
        0x0040:  0000 0000 0000 00                        .......
07:48:40.911414 IP 192.168.97.3.53 > 192.168.97.2.39232: 27822 4/0/1 A 151.101.129.140, A 151.101.193.140, A 151.101.65.140, A 151.101.1.140 (107)
        0x0000:  4500 0087 9800 4000 4011 5f0f c0a8 6103  E.....@.@._...a.
        0x0010:  c0a8 6102 0035 9940 0073 43db 6cae 8180  ..a..5.@.sC.l...
        0x0020:  0001 0004 0000 0001 0361 6473 0672 6564  .........ads.red
        0x0030:  6469 7403 636f 6d00 0001 0001 c00c 0001  dit.com.........
        0x0040:  0001 0000 012c 0004 9765 818c c00c 0001  .....,...e......
        0x0050:  0001 0000 012c 0004 9765 c18c c00c 0001  .....,...e......
        0x0060:  0001 0000 012c 0004 9765 418c c00c 0001  .....,...eA.....
        0x0070:  0001 0000 012c 0004 9765 018c 0000 2910  .....,...e....).
        0x0080:  0000 0000 0000 00                        .......
```

### What version of Traefik are you using?

```
Version:      3.6.0
Codename:     ramequin
Go version:   go1.24.10
Built:        2025-11-07T15:22:08Z
OS/Arch:      linux/arm64
```

### What is your environment & configuration?

Below is a minimal reproducer. DNS service will be available on port 5553 after having run the initial setup wizard in AdGuard home.

```yaml
services:
  traefik:
    image: traefik:v3.6
    container_name: traefik
    restart: unless-stopped
    command:
      - --providers.docker=true
      - --providers.docker.exposedbydefault=false
      - --entrypoints.web.address=:80
      - --entrypoints.dns.address=:53/udp
      - --entrypoints.dns-tcp.address=:53/tcp
      - --api.dashboard=true
      - --log.level=DEBUG
    ports:
      - "80:80"
      - "5553:53/udp"    # DNS UDP
      - "5553:53/tcp"    # DNS TCP
    volumes:
      - /var/run/docker.sock:/var/run/docker.sock:ro

  adguard:
    image: adguard/adguardhome:latest
    container_name: adguard
    restart: unless-stopped
    volumes:
      - ./adguard/work:/opt/adguardhome/work
      - ./adguard/conf:/opt/adguardhome/conf
    labels:
      - "traefik.enable=true"

      - "traefik.http.routers.adguard.rule=Host(`adguard.local`)"
      - "traefik.http.routers.adguard.entrypoints=web"
      - "traefik.http.services.adguard.loadbalancer.server.port=3000"

      - "traefik.tcp.routers.adguard-dns-tcp.rule=HostSNI(`*`)"
      - "traefik.tcp.routers.adguard-dns-tcp.entrypoints=dns-tcp"
      - "traefik.tcp.routers.adguard-dns-tcp.service=adguard-dns-tcp"
      - "traefik.tcp.services.adguard-dns-tcp.loadbalancer.server.port=53"

      - "traefik.udp.routers.adguard-dns.entrypoints=dns"
      - "traefik.udp.services.adguard-dns.loadbalancer.server.port=53"


```

After a `docker compose up`, run the setup wizard presented on the local port 80 web server, followed by non-cached DNS requests using `dig`. For example:

```
dig -p 5553 ads.google.com @localhost
```

### If applicable, please paste the log output in DEBUG level

```
traefik  | 2025-11-10T07:30:56Z DBG github.com/traefik/traefik/v3/pkg/udp/proxy.go:23 > Handling UDP stream from 192.168.97.1:41677 to 192.168.97.2:53
adguard  | 2025/11/10 07:30:56.894918 [error] dnsproxy: unpacking udp packet err="dns: overflow unpacking uint32"
traefik  | 2025-11-10T07:30:57Z DBG github.com/traefik/traefik/v3/pkg/udp/proxy.go:23 > Handling UDP stream from 192.168.97.1:19503 to 192.168.97.2:53
adguard  | 2025/11/10 07:30:57.901307 [error] dnsproxy: unpacking udp packet err="dns: overflow unpacking uint32"
traefik  | 2025-11-10T07:31:02Z DBG github.com/traefik/traefik/v3/pkg/udp/proxy.go:23 > Handling UDP stream from 192.168.97.1:41677 to 192.168.97.2:53
adguard  | 2025/11/10 07:31:02.902774 [error] dnsproxy: unpacking udp packet err="dns: overflow unpacking uint32"
```

**Comment by kevinpollet** [comment]
Hello @leonjza and thanks for opening this,

This seems to be a duplicate of #12251.
Therefore, I am closing it as a duplicate.
